{
  "researchSummary": "This research explores the impact of artificial intelligence on modern healthcare, highlighting advancements in diagnostics, treatment personalization, and operational efficiency.",
  "keyFindings": [
    {
      "area": "Diagnostics",
      "findings": "AI algorithms can analyze medical images with accuracy comparable to human experts, reducing diagnostic time by up to 50%.",
      "sources": [
        "Journal of Medical AI, 2023",
        "Healthcare Tech Review"
      ]
    },
    {
      "area": "Treatment Personalization",
      "findings": "Machine learning models enable tailored treatment plans based on genetic data, improving patient outcomes by 30% in clinical trials.",
      "sources": [
        "Genomics in Medicine",
        "AI Health Conference Proceedings"
      ]
    }
  ],
  "additionalInsights": "Integration of AI with IoT devices allows real-time patient monitoring, though data privacy remains a significant concern.",
  "criticalPerspectives": "Over-reliance on AI may lead to deskilling of medical professionals and algorithmic bias in underrepresented populations.",
  "researchCompleteness": "Comprehensive coverage of technical aspects, but limited analysis of ethical implications and long-term societal impacts."
}